{
  "tagName": "sherpa-container-pdf",
  "description": "Print-optimized container renderer for PDF export via browser print.",
  "category": "page-level",
  "baseClass": "SherpaElement",
  "attributes": [],
  "slots": [],
  "events": [],
  "methods": [
    {
      "name": "setData(sourceContainer, options)",
      "description": "Renders the source container",
      "params": [
        {
          "name": "sourceContainer",
          "type": "any"
        },
        {
          "name": "options",
          "type": "any"
        }
      ]
    }
  ],
  "properties": [
    {
      "name": "includeChart",
      "type": "boolean",
      "description": "Render chart visual (clone SVG/canvas from shadow DOM)"
    },
    {
      "name": "includeMetrics",
      "type": "boolean",
      "description": "Render metrics row"
    },
    {
      "name": "includeDataGrid",
      "type": "boolean",
      "description": "Include tabular data representation"
    }
  ]
}
